Sinh viên,laptop-dell-vostro-3520-f0v0vi3,Laptop Dell Vostro 3520 F0V0VI3 - Nhập khẩu chính hãng,9690000,90,89,dell,vostro,4.9,"Sở hữu thiết kế thanh lịch và đầy chuyên nghiệp, màu đen làm tăng vẻ sang trọng Trang bị vi xử lý Intel Core i3-1215U đem lại hiệu năng ổn định cho công việc hàng ngày và xử lý đa nhiệm mượt mà Bộ nhớ RAM 8GB và ổ cứng SSD PCIe 512GB giúp khởi động và truy cập dữ liệu nhanh chóng Màn hình 15.6 inch FHD tạo ra hình ảnh sắc nét, giúp nâng cao trải nghiệm làm việc và giải trí Laptop này chạy trên Free OS, cho phép người dùng tự do chọn hệ điều hành phù hợp với nhu cầu của mình",Đen,2022,Trung Quốc,Intel UHD Graphics,"Intel Core i3-1215U (15 W, 6 lõi / 8 luồng, 1.20 GHz to 4.40 GHz, 10 MB)",8GB,DDR4 SODIMM,8GB DDR4 SODIMM 2 khe nâng cấp tối đa 16 GB,512GB PCIE,512GB,60 Hz,Tấm nền IPS,15.6 inches,Độ sáng 250 nitsĐộ phủ màu NTSC 45%Thời gian phản hồi 35 ms Màn hình chống chói,1920 x 1080 pixels (FullHD),Âm thanh độ nét cao  Realtek ALC3254  Cirrus 8409,Vỏ nhựa,16.96 - 18.99 x 358.50 x 235.56 mm (H x W x D),1.90 kg,"Wi-Fi 6, Bảo mật vân tay",,,,Free OS,"3-cell, 41 Wh lithium-polymer",Wi-Fi 802.11 a/b/g/n/ac,Bluetooth 5.1,1x Đầu đọc thẻ SD 1x USB 2.0 1x Ethernet (RJ45) 1x Headset (headphone and microphone combo) 1x Khe cắm cáp bảo mật (hình nêm) 1x Đầu nối nguồn 1x HDMI 1.4 2x USB 3.2 Gen 1
Sinh viên,laptop-dell-inspiron-15-3520-6r6nk,Laptop Dell Inspiron 15 3520 6R6NK - Nhập khẩu chính hãng,13490000,4,95,dell,inspiron,4.1,"Trang bị bộ vi xử lý Intel Core i5-1235U, mang lại hiệu suất đáng tin cậy cho các tác vụ hàng ngày. Với 8GB RAM và ổ cứng 512GB, máy đáp ứng tốt nhu cầu lưu trữ và đa nhiệm của người dùng. Màn hình 15.6 inch FHD mang đến trải nghiệm xem đa phương tiện sống động. Thiết kế vỏ nhựa màu đen tối giản, tạo cảm giác sang trọng và tinh tế.",Đen,2023,Đài Loan,Intel UHD Graphics,"Intel Core i5-1235U (10 lõi / 12 luồng, 1.30 GHz to 4.40 GHz, 12 MB)",8GB,DDR4,8GB DDR4 2 khe (tối đa 16GB),512GB PCIE (1 Slot HDD Tối đa 1TB),512GB,120 Hz,Tấm nền IPS,15.6 inches,Độ sáng 250 nits Độ phủ màu NTSC 45%Màn hình chống chói,1920 x 1080 pixels (FullHD),Realtek ALC3204/Realtek ALC3254,Vỏ nhựa,16.96 x 358.50 x 235.56 mm (C x R x S),1.66 kg,Wi-Fi 6,,,,Windows 11 Home,"3-cell, 41 Wh lithium-polymer",Wi-Fi 6 (Card 8821CE-VC),Bluetooth 5.0,1x Đầu nối nguồn 1x HDMI 1.4 2x USB 3.2 Gen 1 1x Khe cắm thẻ SD 1x USB 2.0 1x Cổng tai nghe
Sinh viên,laptop-lenovo-ideapad-flex-5-14iau7-82r700jqvn,Laptop Lenovo IdeaPad Flex 5 14IAU7 82R700JQVN,11490000,7,33,lenovo,ideapad,2.7,"Sở hữu thiết kế tinh tế với tone màu xám đẹp mắt Giải quyết mọi tác vụ học tập, văn phòng với CPU Intel Core i3 - 1215U Màn hình cảm ứng 14 inch 2.2K cực sắc nét hỗ trợ học tập, làm việc, thao tác nhanh chóng RAM 8GB cùng ổ cứng 512GB rộng rãi hỗ trợ lưu trữ nhiều file, tài liệu học tập Trang bị đầy đủ cổng kết nối giúp truyền tải dữ liệu nhanh chóng",Xám,2021,Hàn Quốc,Intel UHD Graphics,"Intel Core i3-1215U (6C (2P + 4E) / 8T, P-core 1.2 / 4.4GHz, E-core 0.9 / 3.3GHz, 10MB)",8GB,LPDDR4x-4266 Onboard,8GB LPDDR4x-4266 Onboard,512GB SSD M.2 2242 PCIe 4.0x4 NVMe,512GB,60Hz,Tấm nền IPS,14 inches,Độ sáng 300nitsĐộ phủ màu 100% sRGBTÜV Low Blue Light,2240 x 1400 pixels,Âm thanh độ phân giải cao (HD)Realtek ALC3287 codec2W x2Dolby Audio,Vỏ kim loại,313.1 x 224.9 x 17.4 mm (W x D x H),1.5 kg,"Wi-Fi 6, Màn hình cảm ứng",LED đơn sắc,Firmware TPM 2.0Bảo mật vân tay,,Windows 11 Home,52.5Wh,"Wi-Fi 6, 11ax 2x2",Bluetooth 5.1,"1x USB 3.2 Gen 1x USB 3.2 Gen 1 (Always On)1x Thunderbolt 4 / USB4 40Gbps (Truyền dữ liệu, Power Delivery 3.0, DisplayPort 1.4a)1x HDMI 1.4b1x Đầu đọc thẻ1x Headphone / microphone combo jack (3.5mm)1x Đầu nối nguồn"
Sinh viên,laptop-hp-pavilion-15-eg2088tu-7c0r0pa,Laptop HP Pavilion 15-EG2088TU 7C0R0PA,19490000,61,91,hp,pavilion,1.9,"Sở hữu thiết kế sang trọng với lớp áo vàng kim sáng bóng, màn hình 15.6 inch độ phân giải Full HD, độ sáng 250 nits đáp ứng hoàn toàn nhu cầu hiển thị trong nhà, lớp học, văn phòng, quán cafe,... Công nghệ BrightView giúp chất lượng hiển thị thêm phần đẹp mắt, bóng bẩy, hình ảnh tươi tắn hơn và vô cùng sống động. CPU Intel Core i7-1260P cùng card đồ họa Intel Iris Xe Graphics không chỉ giải quyết nhanh gọn mọi tác vụ học tập - văn phòng mà còn hỗ trợ giải trí, chơi các tựa game nhẹ cực mướt. RAM 16GB đa nhiệm mượt mà, có thể đồng thời mở nhiều tab và ứng dụng cùng lúc mà không lo đứng máy. Ổ cứng dung lượng lớn 512GB cho không gian lưu trữ lớn, đồng thời giúp cho việc khởi động máy và mở ứng dụng nhanh chóng hơn, rút ngắn thời gian chờ đợi. Máy trang bị đầy đủ các cổng kết nối: USB Type-C, USB Type-A, HDMI,... hỗ trợ kết nối, truyền tải dữ liệu nhanh chóng.",Vàng,2023,Nhật Bản,Intel Iris Xe Graphics,"Intel Core i7-1260P, 12 nhân / 16 luồng, 18MB Intel Smart Cache",16GB,DDR4 3200MHz,16GB DDR4 3200MHz 2 x DDR4 3200MHz,512GB SSD PCIe NVMe M.2,512GB,,Tấm nền IPS,15.6 inches,Bright View  Độ sáng 250nits  Độ phủ màu 45% NTSC  Tần số quét 60Hz,1920 x 1080 pixels (FullHD),,Vỏ kim loại,36.02 x 23.4 x 1.79 cm (W x D x H),1.75 kg,Wi-Fi 6,,,,Windows 11 Home 64bit,3 Cell 41 WHrs 3440mAh,Wifi Realtek RTL8822CE 802.11a/b/g/n/ac (2x2),Bluetooth 5.0 Combo,"1x USB Type-C (Sạc, DisplayPort 1.4, HP ngủ và sạc) 2x USB 3.0 Type-A  1x HDMI 2.01x Headphone/microphone combo"
Sinh viên,laptop-lenovo-ideapad-slim-5-15iru9-83d00003vn,Laptop Lenovo IdeaPad Slim 5 15IRU9 83D00003VN,19490000,59,71,lenovo,ideapad,4.7,"Sở hữu chip xử lý Intel CORE 5-120U, một con chip hiệu năng cao xử lý mọi tác vụ học tập, văn phòng. Máy được trang bị 32GB RAM và ổ SSD 512GB PCIe, mang lại sức mạnh xử lý nhanh chóng và dung lượng lưu trữ rộng rãi. Màn hình kích thước 15.3 inch với độ phân giải WUXGA (1920 x 1200) mang đến chất lượng hiển thị sắc nét và chi tiết. Thiết kế nhôm nguyên khối mang đến vẻ ngoài thanh lịch và cảm giác cầm nắm chắc chắn.",Xám,2023,Nhật Bản,Intel Graphics,"Intel Core 5 120U, 10C (2P + 8E) / 12T, P-core 1.4 / 5.0GHz, E-core 0.9 / 3.8GHz, 12MB",32GB,LPDDR5x-5200 Onboard,32GB LPDDR5x-5200 Onboard,"512GB SSD M.2 2242 PCIe 4.0x4 NVMe (Một ổ đĩa, up to 1TB M.2 2242 SSD)",512GB,,Tấm nền IPS,15.3 inches,Độ sáng 300nits  Màn hình chống chói Độ phủ màu 100% sRGB,1920 x 1200 pixels (WUXGA),"High Definition (HD) Audio Loa stereo, 2W x2 Dolby Audio",Vỏ kim loại,343.5 x 238.21 x 17.42 mm (W x D x H),1.79 kg,Wi-Fi 6,,Firmware TPM 2.0 Enabled IR camera for Windows Hello,,Windows 11 Home Single Language,57Wh,"Wi-Fi 6, 802.11ax 2x2",Bluetooth 5.2,"1x USB-A (USB 5Gbps / USB 3.2 Gen 1) 1x USB-A (USB 5Gbps / USB 3.2 Gen 1), Always On 2x USB-C (USB 5Gbps / USB 3.2 Gen 1), với USB PD 3.0 và DisplayPort 1.4 1x HDMI 1.4 1x Headphone / microphone combo jack (3.5mm) 1x Đầu đọc microSD"
Sinh viên,laptop-msi-modern-14-c7m-221vn,Laptop MSI Modern 14 C7M-221VN,10490000,33,54,msi,modern,3.9,"Trang bị bộ vi xử lý AMD Ryzen 7 7730U mạnh mẽ cân mọi tác vụ học tập, văn phòng. Có RAM 8GB và ổ cứng SSD 512GB PCIe tốc độ cao, màn hình 14 inch Full HD cho hình ảnh sắc nét. Chạy hệ điều hành Windows 11 mới nhất, sẵn sàng cho mọi tác vụ. Thiết kế màu đen sang trọng và hiện đại, kiểu dang mỏng nhẹ phù hợp di chuyển.",Đen,2021,Singapore,AMD Radeon Graphics,"AMD Ryzen R7-7730U (Tốc độ tối đa: 4.5GHz, 8  lõi / 16 luồng, 16MB Cache)",8GB,LPDDR4 Onboard,8GB LPDDR4 Onboard Không,SSD 512GB M.2 PCIe Gen3,SSDGB,60 Hz,Tấm nền IPS,14 inches,Độ phủ màu 45%NTSC Màn hình chống chói  Góc mở 180 độ,1920 x 1080 pixels (FullHD),,,320 x 223 x 19.5 mm (Dài x Rộng x Dày),1.4 kg,Wi-Fi 6,Single LED - Trắng,,,Windows 11 Home SEA,"3 Cell, 39.3 WHrs",AMD Wi-Fi 6E RZ608,Bluetooth 5.3,1 x HDMI 1 x USB Type-C (Hỗ trợ sạc) 3 x USB 3.2 & USB 2.0 1 x DC-in 1x Jack Audio 3.5mm Đầu đọc MicroSD
Sinh viên,laptop-dell-vostro-3520-f0v0v256,Laptop Dell Vostro 3520 F0V0V256 - Nhập khẩu chính hãng,11990000,18,9,dell,vostro,1.3,"Trang bị bộ vi xử lý Intel Core i5-1235U xử lý một loạt các nhiệm vụ từ lướt web, soạn thảo văn bản, chỉnh sửa hình ảnh đơn giản RAM 8GB, một dung lượng đủ lớn để chạy nhiều ứng dụng cùng một lúc mà không gây ra hiện tượng máy bị giật lag hay đứng máy Ổ cứng SSD PCIe 256GB, giúp tăng tốc độ truy cập dữ liệu và khởi động máy nhanh chóng Màn hình Full HD 15.6 inch mang đến hình ảnh rõ nét và màu sắc trung thực Hệ điều hành Free OS, cho phép bạn tự do lựa chọn hệ điều hành phù hợp với nhu cầu sử dụng của mình",Đen,2021,Đài Loan,Intel Iris Xe Graphics,"Intel Core i5-1235U (10 lõi / 12 luồng, 1.30 GHz to 4.40 GHz, 12 MB)",8GB,DDR4,8GB DDR4 2 khe SODIMM (Nâng cấp tối đa 16GB),256 GB SSD NVMe PCIe,256GB,60 Hz,,15.6 inches,Độ phủ màu NTSC 45%  Màn hình chống chói,1920 x 1080 pixels (FullHD),,Vỏ nhựa,16.96 - 18.99 x 358.50 x 235.56 mm (H x W x D),1.90 kg,,,,,Free OS,,Có,Có,"1x RJ45 Ethernet  2x USB 3.2 Gen 1 1x USB 3.2 Gen 1 1x USB 3.2 Gen 1 Type-C (DisplayPort 1.4) 1x USB 2.0  1x HDMI 1.4  1x USB 3.2 Gen 1 Type-C với DisplayPort 1.4 1x Khe cắm thẻ SD 1x Bộ đổi nguồn AC 65 W, 4,5 mm"
Sinh viên,laptop-lenovo-ideapad-slim-3-15abr8-82xm00ehvn,Laptop Lenovo IdeaPad Slim 3 15ABR8 82XM00EHVN,14490000,94,88,lenovo,ideapad,1.7,"Sở hữu chip AMD Ryzen 7 7730U mạnh mẽ, RAM 16GB đáp ứng tốt nhu cầu làm việc, học tập và giải trí. Màn hình 15.6 inch FHD (1920x1080) cho không gian hiển thị rộng rãi, hình ảnh sắc nét, sống động. Lenovo IdeaPad Slim 3 có thiết kế thanh lịch, mỏng nhẹ với màu xám thời trang, dễ dàng mang theo bên mình. Ổ cứng SSD 512GB PCIe cho tốc độ truy xuất dữ liệu nhanh chóng, khởi động máy và mở ứng dụng chỉ trong vài giây.",Xám,2024,Hàn Quốc,AMD Radeon Graphics,"AMD Ryzen 7 7730U (8 lõi / 16 luồng, 2.0 / 4.5GHz, 4MB L2 / 16MB L3)",16GB,DDR4-3200 Onboard,16GB DDR4-3200 Onboard,"512GB SSD M.2 2242 PCIe 4.0x4 NVMe (One drive, up to 1TB M.2 2242 SSD)",512GB,,Tấm nền IPS,15.6 inches,Độ sáng 300nits  Màn hình chống chói,1920 x 1080 pixels (FullHD),"High Definition (HD) Audio Loa âm thanh nổi hướng về phía người dùng, 1,5W x2 Dolby Audio",Vỏ nhựa,359.3 x 235 x 17.9 mm (WxDxH),1.62 kg,"Wi-Fi 6, Bảo mật vân tay",,Firmware TPM 2.0 Enabled,,Windows 11 Home Single Language,47Wh,"Wi-Fi 6, 802.11ax 2x2",Bluetooth 5.2,"2x USB 3.2 Gen 1  1x USB-C 3.2 Gen 1 (support data transfer, Power Delivery and DisplayPort 1.2) 1x HDMI 1.4 1x Headphone / microphone combo jack (3.5mm) 1x Đầu đọc thẻ 1x Đầu nối nguồn"
Sinh viên,laptop-acer-aspire-3-a315-58-53s6,Laptop Acer Aspire 3 A315-58-53S6 NX.AM0SV.005,9990000,87,94,acer,aspire,2.2,"Thoải mái lưu trữ - 256GB SSD + 1 khe HDD trống cho phép nâng cấp 4GB onboard + 4GB trên khe cho khả năng nâng cấp tối đa 12GB Thoả sức giải trí với các bộ phim hay edit hình ảnh - Màn hình Full HD, kích thước 15.6 inch Chơi game nhẹ nhàng với card đồ hoạ Intel® Iris® Xe Graphics",Vàng,2024,Hàn Quốc,Intel Iris Xe Graphics,"Intel Core i5-1135G7 4 nhân 8 luồng, 2.40 GHz up to 4.20 GHz, 8 MB L3",8GB,"DDR4, tốc độ bus 2400Mhz","8GB DDR4, tốc độ bus 2400Mhz Nâng cấp tối đa 12GB (4GB onboard cắm sẵn + 4GB khe rời)",256GB PCIe NVMe SSD (nâng cấp tối đa 2TB HDD và 1TBSSD PCIe NVMe),256GB,60 Hz,Tấm nền TN,15.6 inches,Acer ComfyView LED-backlit,1920 x 1080 pixels (FullHD),Loa Stereo,Vỏ nhựa,363.4 (W) x 247.5 (D) x 19.9 (H) mm,1.7 kg,,Không,,720P,Windows 11 Home SL,36.7 Wh 2-cell Li-ion battery,802.11 a/b/g/n/ac,v5.0,1 x USB 2.01 x HDMI®2.0 1 x Combo mic tai nghe 3.5mm 1 x Ethernet (RJ-45)  2 x USB 3.2 Gen 1 1 DC-in jack
Sinh viên,laptop-lenovo-v14-g4-iru-83a000bgvn,Laptop Lenovo V14 G4 IRU 83A000BGVN,13490000,86,71,lenovo,v14,2.2,"Trang bị chip Intel Core i5-13420H thế hệ 13 mới nhất, xử lý mượt mà mọi tác vụ văn phòng, học tập và giải trí. RAM 16GB và ổ cứng SSD 512GB PCIe cho khả năng đa nhiệm mượt mà, khởi động máy và truy xuất dữ liệu nhanh chóng. Vỏ máy màu xám lịch lãm, phù hợp với môi trường công sở chuyên nghiệp. Thiết kế mỏng nhẹ, dễ dàng mang theo bên mình để làm việc và học tập mọi lúc mọi nơi. Cấu hình mạnh mẽ, thiết kế hiện đại với mức giá hợp lý, là lựa chọn lý tưởng cho người dùng phổ thông.",Xám,2022,Hàn Quốc,Intel UHD Graphics,"Intel Core i5-13420H, 8C (4P + 4E) / 12T, P-core 2.1 / 4.6GHz, E-core 1.5 / 3.4GHz, 12MB",16GB,DDR4-3200,16GB DDR4-3200 8GB Soldered DDR4-3200 + 8GB SO-DIMM DDR4-3200,512GB SSD M.2 2242 PCIe 4.0x4 NVMe,512GB,,Tấm nền IPS,14 inches,Độ sáng 350 nits  Màn hình chống chói  Độ phủ màu 45% NTSC,1920 x 1080 pixels (FullHD),"Âm thanh độ nét cao (HD)  Realtek® ALC3287 codec  Loa âm thanh nổi, 1.5W x2  Dolby Audio",Vỏ nhựa,324.2 x 215.2 x 19.9 mm,1.43 kg,,,"Firmware TPM 2.0 EnabledKhe cắm bảo mật Nano Kensington, 2,5 x 6 mm",720p HD với màn trập camera,Free OS,38Wh,"Wi-Fi 5, 802.11ac 2x2",Bluetooth 5.1,"1x USB 2.0 1x USB 3.2 Gen 1 1x USB-C 3.2 Gen 1 (hỗ trợ truyền dữ liệu, Power Delivery 3.0 and DisplayPort 1.2) 1x HDMI 1.4b 1x Headphone / microphone combo jack (3.5mm) 1x Ethernet (RJ-45) 1x Đầu nối nguồn"
Sinh viên,laptop-hp-pavilion-15-eg3111tu-8u6l8pa,Laptop HP Pavilion 15-EG3111TU 8U6L8PA,17490000,60,0,hp,pavilion,4.2,"CPU Intel Core i5, RAM 16GB và ổ cứng SSD 512GB PCIe cho khả năng xử lý nhanh chóng mọi tác vụ từ văn phòng, học tập đến giải trí. Màn hình 15.6 inch FHD (1920x1080) mang đến không gian hiển thị rộng rãi và hình ảnh sắc nét, sống động. Sở hữu thiết kế thanh lịch với lớp vỏ màu bạc sang trọng, phù hợp với nhiều đối tượng người dùng. Với cấu hình mạnh mẽ, HP Pavilion 15 giúp bạn dễ dàng xử lý cùng lúc nhiều tác vụ mà không gặp trở ngại. Máy được cài đặt sẵn Windows 11 bản quyền, mang đến giao diện hiện đại và nhiều tính năng mới mẻ cho trải nghiệm người dùng tuyệt vời.",Bạc,2023,Hàn Quốc,Intel Iris Xe Graphics,"Intel Core i5-1335U (up to 4.6 GHz with Intel Turbo Boost Technology,12 MB L3 cache,10 lõi,12 luồng)",16GB,DDR4-3200 MHz RAM,16GB DDR4-3200 MHz RAM 2 x 8 GB,512 GB PCIe NVMe M.2 SSD,512GB,,Tấm nền IPS,15.6 inches,Màn hình chống chóiĐộ sáng 250 nits  Độ phủ màu 45% NTSC,1920 x 1080 pixels (FullHD),Audio by B&O Dual speakers HP Audio Boost,,36.02 x 23.4 x 1.8 cm,1.6 kg,,,,HP Wide Vision 720p HD camera,Windows 11 Home Single Language,"3-cell, 41 Wh Li-ion",,,1x USB Type-C  2x USB Type-A  1x HDMI 2.1 1x AC smart pin 1x headphone/microphone combo
Sinh viên,laptop-dell-vostro-3520-f0v0v,Laptop Dell Vostro 3520 F0V0V,12590000,41,11,dell,vostro,2.0,"Trang bị bộ vi xử lý Intel Core i5 1235U xử lý mượt mà và hiệu quả các tác vụ thường ngày như lướt web, soạn thảo săn bản, xem phim, giải trí,.. RAM 8 GB đa nhiệm, đủ để sử dụng cho các tác vụ học tập, làm việc văn phòng. Ổ cứng SSD 512 GB có tốc độ đọc, ghi cao, rút ngắn đáng kể thời gian phản hồi, khởi động máy hay các phần mềm nhanh chóng. Màn hình lớn 15.6 inch Full HD mang đến góc nhìn được tối ưu, rộng lớn và đã mắt với chất lượng hình ảnh hiển thị rõ nét.",Đen,2022,Đài Loan,Intel Iris Xe,Intel Core i5-1235U,8GB,DDR4,8GB DDR4,"512 GB, M.2 2230, PCIe NVMe Gen4 x4",512GB,120 Hz,Tấm nền IPS,15.6 inches,,1080 x 1920 pixels (FullHD),,,358.50 mm x 235.56 mm x 22.47 mm (Ngang - dọc - dày),1.66 kg,Wi-Fi 6,,,720p at 30 fps,Free OS,"3 cells , 41WHr","Intel® AX201, 2x2 MIMO, 2400 Mbps, 2.4/5 GHz, Wi-Fi 6 (WiFi 802.11ax)",Có,2 USB 3.2 Gen 11 USB 2.0 port 1 headset (headphone and microphone combo) port 1 HDMI 1.4 port HDMI 1.4 (Maximum resolution supported over HDMI is 1920x1080 @60Hz. No 4K/2K output) 1 RJ45 Ethernet port (flip-down
Sinh viên,laptop-lenovo-v15-g4-iru-83a100fyvn,Laptop Lenovo V15 G4 IRU 83A100FYVN,13490000,15,6,lenovo,v15,1.3,"Trang bị bộ vi xử lý Intel Core i5-13420H, một con chip hiệu suất cao cân mọi tác vụ học tập, văn phòng. Máy có 8GB RAM DDR4 để đáp ứng tốt các tác vụ văn phòng, lướt web và đa nhiệm cơ bản. Ổ cứng SSD 512GB PCIe mang lại tốc độ khởi động và truy xuất dữ liệu nhanh chóng, cải thiện trải nghiệm sử dụng. Màn hình 15.6 inch Full HD với độ phân giải 1920 x 1080 cho hình ảnh sắc nét và chất lượng hiển thị tốt. Thiết kế với màu xám lịch lãm, phù hợp cho môi trường văn phòng và di chuyển.",Xám,2022,Đài Loan,Intel UHD Graphics,"Intel Core i5-13420H, 8C (4P + 4E) / 12T, P-core 2.1 / 4.6GHz, E-core 1.5 / 3.4GHz, 12MB",8GB,DDR4-3200 Onboard,8GB DDR4-3200 Onboard 1 bộ nhớ được hàn vào máy (8GB) + 1 khe DDR4 nâng cấp tối đa 16GB,512GB SSD M.2 2242 PCIe 4.0x4 NVMe (up to 1TB),512GB,,Tấm nền IPS,15.6 inches,Độ sáng 300nits Màn hình chống chóiĐộ phủ màu 45% NTSC,1920 x 1080 pixels (FullHD),"Âm thanh độ nét cao (HD) Bộ giải mã Realtek ALC3287 Loa stereo, 1,5W x2 Dolby Audio",Vỏ nhựa,359.2 x 235.8 x 19.9 mm (W x D x H),1.65 kg,,,Firmware TPM 2.0 Enabled,HD 720p với màn trập camera,Windows 11 Home Single Language,38Wh,"Wi-Fi 5, 802.11ac 2x2",Bluetooth 5.1,"1x USB 2.0 1x USB 3.2 Gen 1 1x USB-C 3.2 Gen 1 (Truyền dữ liệu, Power Delivery 3.0, DisplayPort 1.2) 1x HDMI 1.4b 1x Headphone / microphone combo jack (3.5mm) 1x Ethernet (RJ-45) 1x Đầu nối nguồn"
Sinh viên,laptop-asus-expertbook-b1-b1502cva-nj0101w,Laptop ASUS ExpertBook B1 B1502CVA-NJ0101W,9990000,55,69,asus,expertbook,1.1,"Máy tính này được trang bị bộ vi xử lý Intel Core i3-1315U đảm bảo hiệu suất xuất sắc trong việc thực hiện nhiều loại tác vụ, từ đơn giản đến nâng cao. Với sự hỗ trợ của 8GB RAM và ổ đĩa SSD có dung lượng 256 GB, cung cấp tốc độ và hiệu suất làm việc mượt mà. Màn hình 15.6 inch, độ phân giải Full HD, đem lại trải nghiệm xem phim, lướt web và chỉnh sửa ảnh cơ bản với hình ảnh rõ nét và chất lượng cao. Cấu trúc vỏ máy được thiết kế chắc chắn, mang lại vẻ đẹp sang trọng cùng độ bền cao.",Đen,2022,Đài Loan,Intel UHD Graphics,"Intel Core i3-1315U (1.2 GHz, 10M Cache, up to 4.5 GHz, 6 lõi)",8GB,DDR4 Onboard,8GB DDR4 Onboard,256GB M.2 2280 NVMe PCIe 4.0 SSD,256GB,60 Hz,Tấm nền TN,15.6 inches,Độ sáng 250 nits  Độ phủ màu NTSC: 45% Màn hình chống chóiTỷ lệ tương phản 500:1Góc nhìn: 90/65 Thời gian phản hồi:  20/10 ms 16:9,1920 x 1080 pixels (FullHD),Âm thanh Dirac Loa tích hợp Micrô mảng tích hợp,Vỏ nhựa,36.16 x 23.30 x 1.99 cm (W x H x D),1.69 kg,"Wi-Fi 6, Bảo mật vân tay",,Cảm biến vân tay tích hợp Touchpad Khe bảo mật Kensington Nano Khởi động BIOS Bảo vệ mật khẩu người dùng Mật khẩu người dùng thiết lập BIOS Máy tính đã sẵn sàng từ BIOS Bảo vệ và bảo mật mật khẩu người dùng HDD Mô-đun nền tảng đáng,720p HD với màn trập camera,Windows 11 Home,"42WHrs, 3S1P, 3-cell Li-ion",Wi-Fi 6 (802.11ax) (Dual band) 2*2,Bluetooth 5.2,1x USB 2.0 Loại A 1x USB 3.2 Gen 1 Loại A 1x USB 3.2 Gen 1 Type-C 1x USB 3.2 Gen 2 Type-C h 1x HDMI 1.4 1x Giắc âm thanh 1x RJ45 Gigabit Ethernet
Sinh viên,laptop-hp-240-g9-9e5w3pt,Laptop HP 240 G9 9E5W3PT,13990000,60,27,hp,hp,2.1,"Trang bị chip Intel Core i5, RAM 8GB và ổ cứng SSD 512GB PCIe cho khả năng xử lý mượt mà các tác vụ văn phòng, học tập và giải trí cơ bản. Màn hình 14 inch FHD (1920x1080) mang đến trải nghiệm hình ảnh rõ nét, sống động cho công việc và giải trí. Với trọng lượng chỉ từ 1.47kg, HP 240 G9 dễ dàng mang theo bên mình mọi lúc mọi nơi. Máy được cài đặt sẵn Windows 11 bản quyền, mang đến giao diện hiện đại và nhiều tính năng mới mẻ.",Bạc,2024,Nhật Bản,Intel Iris Xe Graphics,"Intel Core i5-1235U (up to 4.4 GHz with Intel Turbo Boost Technology,12 MB L3 cache,10 lõi /12 luồng)",8GB,DDR4-3200 MHz RAM (1 x 8 GB),8GB DDR4-3200 MHz RAM (1 x 8 GB) 1 x 8 GB,512 GB PCIe NVMe SSD,512GB,,Tấm nền IPS,14 inches,Độ sáng 250 nits Độ phủ màu 45% NTSC br>Màn hình chống chóiViền mỏng,1920 x 1080 pixels (FullHD),"Loa âm thanh nổi kép, micrô mảng kép",,32.4 x 22.59 x 1.99 cm,1.47 kg,,,,HP camera 720 HD,Windows 11,"3-cell, 41 Wh Li-ion",,,1x USB Type-C  2x USB Type-A  1x AC power 1x HDMI 1.4b 1x Stereo headphone/microphone combo jack 1x RJ-45
Sinh viên,laptop-asus-vivobook-15x-oled-m3504ya-l1332w,Laptop ASUS Vivobook 15X OLED M3504YA-L1332W,15990000,95,32,asus,vivobook,3.2,"Laptop không chỉ mạnh mẽ, đa năng, mà còn có màn hình OLED tuyệt đẹp Bộ vi xử lý AMD Ryzen 7-7730U và card đồ họa AMD Radeon Graphics hỗ trợ học tập, làm việc cho đến giải trí Bộ nhớ RAM 16 GB, ổ cứng SSD 512 GB cho thời gian mở máy, lướt web, mở ứng dụng nhanh chóng Màn hình 15.6 inch cho bạn trải nghiệm hình ảnh sống động, rực rỡ và chi tiết, tỷ lệ tương phản cao và màu sắc chuẩn xác Laptop còn có thiết kế đẹp mắt và bền bỉ và độ bền đạt chuẩn quân đội",Đen,2022,Trung Quốc,AMD Radeon Graphics,"AMD Ryzen 7-7730U (2.0GHz, 8 lõi / 16 luồng, 16MB cache, up to 4.5 GHz max boost)",16GB,DDR4,16GB DDR4  2 khe (8 GB DDR4 on board + 8 GB DDR4 SO-DIMM),512GB M.2 NVMe PCIe 3.0 SSD,512GB,60 Hz,Tấm nền Oled,15.6 inches,Thời gian phản hồi 0.2ms  Độ sáng tối đa 600nits HDR Độ phủ màu 100% DCI-P3 Gamut mapping HDR True Black 600 1.07 tỷ màu Giảm ánh sáng xanh 70%  TÜV Rheinland-certified,1920 x 1080 pixels (FullHD),SonicMaster  Loa tích hợp Micrô mảng tích hợp,,35.97 x 23.25 x 1.79 ~ 1.79 cm (W x H x D),1.60 kg,"Wi-Fi 6, Màn hình Oled",,McAfee dùng thử miễn phí 30 ngày  McAfee Khởi động BIOS Bảo vệ mật khẩu người dùng Mật khẩu người dùng thiết lập BIOS Mô-đun nền tảng đáng tin cậy (Firmware TPM),720p HD camera với màn trập camera,Windows 11 Home,"50WHrs, 3S1P, 3-cell Li-ion",Wi-Fi 6E (802.11ax) (Dual band) 1*1,Bluetooth 5.3,1x USB 2.0 Type-A  1x USB 3.2 Gen 1 Type-C hỗ trợ sạc 2x USB 3.2 Gen 1 Type-A 1x HDMI 1.4 1x 3.5mm Combo Audio Jack 1x DC-in
Sinh viên,laptop-asus-expertbook-b1-b1502cba-nj1261w,Laptop ASUS ExpertBook B1 B1502CBA-NJ1261W,9490000,31,95,asus,expertbook,3.8,"Bộ xử lý Intel Core i3-1215U đảm bảo hiệu suất đỉnh cao, đáp ứng mượt mà mọi tác vụ văn phòng và giải trí. RAM 8GB, máy tính duy trì hiệu suất ổn định, và ổ đĩa SSD 256GB cung cấp không gian lưu trữ nhanh chóng và đáng tin cậy. Màn hình FHD 15.6 inch giúp hiển thị hình ảnh sắc nét và rõ ràng, tối ưu cho công việc văn phòng và giải trí. Được trang bị tính năng bảo mật Finger Print và TPM, đảm bảo an toàn thông tin cá nhân và dữ liệu quan trọng của bạn.",Đen,2023,Hàn Quốc,Intel UHD Graphics,"Intel Core i3-1215U (1.2 GHz, 10M Cache, up to 4.4 GHz, 6 lõi)",8GB,DDR4 Onboard,8GB DDR4 Onboard,256GB M.2 NVMe PCIe 4.0 SSD,256GB,60 Hz,Tấm nền TN,15.6 inches,Độ sáng 250nits Độ phủ màu 45% NTSC  Màn hình chống chói,1920 x 1080 pixels (FullHD),Âm thanh của DiracLoa tích hợpMicrô mảng tích hợp,Vỏ nhựa,36.16 x 23.30 x 1.99 ~ 1.99 cm,1.69 Kg,"Wi-Fi 6, Bảo mật vân tay",,Cảm biến vân tay tích hợp với TouchpadKensington Nano Security SlotBảo vệ mật khẩu người dùng khởi động BIOSMật khẩu người dùng thiết lập BIOSMáy tính sẵn sàng từ BIOSBảo vệ và bảo mật mật khẩu người dùng HDDMô-đun nền tảng đáng t,720P HD với màn trập camera,Windows 11 Home,"42WHrs, 3S1P, 3-cell Li-ion",Wi-Fi 6(802.11ax) (Dual band) 2*2,Bluetooth 5.3,1x USB 2.0 Type-A1x USB 3.2 Gen 1 Type-A1x USB 3.2 Gen 1 Type-C (Hỗ trợ sạc)1x USB 3.2 Gen 2 Type-C (Display / Sạc)1x HDMI 1.41x 3.5mm Combo Audio Jack1x RJ45 Gigabit Ethernet
