label,slug,title,discountPrice,soldQuantity,quantity,brand,series,totalRating,features,color,Năm ra mắt,Xuất xứ,Loại card đồ họa,Loại CPU,Dung lượng RAM,Loại RAM,Mô tả ram,Ổ cứng,Dung lượng ổ cứng,Tần số quét,Chất liệu tấm nền,Kích thước màn hình,Công nghệ màn hình,Độ phân giải màn hình,Công nghệ âm thanh,Chất liệu,Kích thước,Trọng lượng,Tính năng đặc biệt,Loại đèn bàn phím,Bảo mật,Webcam,Hệ điều hành,Pin,Wi-Fi,Bluetooth,Cổng giao tiếp
Sinh viên,laptop-dell-latitude-e7440,Laptop Dell Latitude E7440,14000000,54,0,dell,latitude,0.0,"Trợ thủ đắc lực cho dân văn phòng với cân nặng chỉ 1.63kg dễ dàng bỏ vào balo Màn hình 14 inch độ phân giải 1366 x 768 px cho hình ảnh rõ nét, chất lượng cao CPU Core i5 giúp xử lý nhanh mọi tác vụ mượt mà RAM 8GB đa nhiệm cùng ổ cứng 128GB hỗ trợ mở máy, khởi động ứng dụng nhanh chóng Trang bị đa dạng cổng kết nối, hỗ trợ truyền tải dữ liệu chỉ trong giây lát",Đen,2023,Đài Loan,Intel HD Graphics 4400,"Intel Core i5-4300U (1.90 GHz,  Turbo Boost 2.9 GHz)",8GB,DDR3L 1600 MHz,8GB DDR3L 1600 MHz 2 khe RAM (Nâng cấp tối đa 16 GB),SSD 128GB,128GB,,,14 inches,,1366 x 768 pixels,Combo Microphone & Headphone,Vỏ nhựa,337 x 231.5 x 21 mm (Dài x Rộng x Dày),1.63 kg,,,,HD webcam,,4-cell Li-ion,,Có,1x Mini DisplayPort  1x HDMI 1x LAN (RJ45) 3x USB 3.0
Sinh viên,laptop-asus-vivobook-14-x1404za-nk075w,Laptop ASUS VivoBook 14 X1404ZA-NK075W,18000000,66,1,asus,vivobook,0.0,"Thiết kế mỏng nhẹ chỉ 1.4 kg dễ dàng bỏ vào balo mang đi khắp nơi. CPU Intel Core i3 1215U mạnh mẽ, cho tốc độ nhanh hơn, xử lý mượt mà hơn. RAM 8 GB thể thoải mái làm nhiều công việc cùng lúc mà không lo giật, lag. Ổ cứng SSD 256 GB giúp máy khởi động, tắt máy hay sao chép, di chuyển dữ liệu nhanh chóng.",Xanh,2024,Nhật Bản,Intel UHD Graphics,"Intel Core i3-1215U (1.2 GHz - 4.4 GHz, 10MB, 6 nhân / 8 luồng)",8GB,DDR4 Onboard,"8GB DDR4 Onboard 8GB Onboard + 2 Khe cắm, hỗ trợ tối đa 16GB",256GB SSD M.2 NVMe,256GB,60Hz,Tấm nền IPS,14 inches,"Tỷ lệ khung hình 16:9Đèn nền LEDTần số làm mới 60Hz 250nits Dải màu 45% NTSCMàn hình chống chói,",1920 x 1080 pixels (FullHD),SonicMasterLoa tích hợpMicrô array tích hợp hỗ trợ nhận dạng giọng Cortana,,32.49 x 21.39 x 1.79 cm,1.4 kg,Wi-Fi 6,,,720p HD webcam,Windows 11 Home,"42WHrs, 3S1P, Li-ion 3 pin",Wi-Fi 6E(802.11ax) (Băng tần kép) 1*1,Bluetooth 5.3,"1x USB 2.0 Type-A1x USB 3.2 Gen 1 Type-C 2x USB 3.2 Gen 1 Type-A1x HDMI 1.4 1x Giắc Âm thanh Kết hợp 3,5 mm 1x Nguồn vào DC"
Sinh viên,laptop-hp-pavilion-15-eg3112tu-8u6l9pa,Laptop HP Pavilion 15-EG3112TU 8U6L9PA,20000000,75,26,hp,pavilion,3.8,"Sở hữu thiết kế sang trọng với lớp vỏ màu bạc tinh tế Màn hình 15.6 inch Full HD cho hình ảnh sắc nét, màu sắc chân thực, hỗ trợ làm việc, học tập hay giải trí thoải mái CPU Intel Core i7-1335U đáp ứng tốt các tác vụ học tập và làm việc hay chỉnh sửa hình ảnh cơ bản Ổ cứng 512GB SSD cho không gian lưu trữ lớn, khởi động máy, mở ứng dụng nhanh chóng RAM 16GB cho phép laptop chạy nhiều tác vụ cùng lúc và xử lý dữ liệu mượt mà hơn Đầy đủ các cổng kết nối cho phép kết nối với các thiết bị ngoại vi dễ dàng",Bạc,2022,Trung Quốc,Intel Iris Xe Graphics,"Intel Core i7 - 1335U (3.70 GHz, up to 5.00 GHz)",16GB,DDR4 3200 MHz,"16GB DDR4 3200 MHz 2 khe (1 khe 8 GB + 1 khe 8 GB, hỗ trợ nâng cấp tối đa 32 GB)",512 GB SSD M2. PCIe,512GB,,Tấm nền IPS,15.6 inches,,1920 x 1080 pixels (FullHD),,Vỏ kim loại,360.2 x 234 x 18 mm (Dài x Rộng x Dày),1.69 kg,Wi-Fi 6,,,Camera HP Wide Vision HD,Windows 11 Home Single Language,3-cell,802.11 ax,Bluetooth 5.2,1x USB 3.2 Gen 2 2x USB 3.2 Gen 1 1x HDMI
Sinh viên,laptop-hp-pavilion-15-eg2082tu-7c0q5pa,Laptop HP Pavilion 15-EG2082TU 7C0Q5PA,12000000,66,10,hp,pavilion,3.0,"Hiệu suất ổn định với chip Intel Core i5-1240P thế hệ thứ 12 đáp ứng nhanh chóng các tác vụ văn phòng cùng việc học tập, giải trí cơ bản trên nền game nhẹ Tấm nền IPS trên màn hình rộng 15.6 inches cho trải nghiệm màu sắc chân thực, thoải mái Mọi thao tác trở nên mượt mà hơn với RAM 8GB đa nhiệm Sở hữu không gian lưu trữ thoải mái, khởi động máy nhanh hơn với ổ cứng SSD 512GB Đa dạng cổng giao tiếp, dễ dàng sử dụng",Vàng,2021,Singapore,Intel Iris Xe Graphics,Intel Core i5-1240P thế hệ thứ 12,8GB,DDR4 3200MHz,8GB DDR4 3200MHz  2 khe,512GB SSD M.2 NVMe,512GB,,Tấm nền IPS,15.6 inches,"15.6"" ( 1920 x 1080 ) Full HD, IPS",1920 x 1080 pixels (FullHD),,,36.02 x 23.4 x 1.79 cm,1.7 kg,Wi-Fi 6,,,HD webcam,Windows 11 Home SL,3 cell 41 Wh,WiFi 802.11ax (Wifi 6),v5.2,"1 x HDMI1 x USB Type C / DisplayPort / Power Delivery2 x USB 3.2,  Audio combo"
Sinh viên,laptop-hp-pavilion-x360-14-ek0132tu-7c0w4pa,Laptop HP Pavilion X360 14-EK0132TU 7C0W4PA,18000000,84,99,hp,pavilion,1.1,"Thiết kế sang trọng, cấu hình mạnh mẽ với màn hình có khả năng biến đổi linh hoạt xoay gập 360 độ giúp bạn sáng tạo và giải trí không giới hạn với mọi tư thế. Kích thước 14 inch, tấm nền IPS với độ phân giải Full HD cho góc nhìn chân thực, màu sắc sống động, hình ảnh chất lượng sắc nét hơn. Cấu hình chất lượng với bộ vi xử lý Intel core i7-1255U cùng card đồ họa Intel Iris Xe Graphics xử lý nhanh chóng mọi tác vụ học tập - văn phòng kể cả các tác vụ giải trí một cách mượt mà. RAM 16GB kết hợp với ổ cứng 512GB SSD cho không gian lưu trữ vô cùng thoải mái giúp các tác vụ đa nhiệm, khởi chạy, sao chép dữ liệu nhanh chóng. Tích hợp bảo mật vân tay, giúp bảo mật dữ liệu mở máy chỉ trong vài giây chỉ với một lần chạm. Hệ điều hành Windows 11 bản quyền đảm bảo cho quá trình sử dụng luôn luôn ổn định.",Vàng,2023,Nhật Bản,Intel Iris Xe Graphics,"Intel Core i7-1255U 10 nhân / 12 luồng, 12 MB Intel Smart Cache",16GB,DDR4 3200MHz,16GB DDR4 3200MHz,512GB SSD PCIe NVMe M.2,512GB,,Tấm nền IPS,14 inches,Màn hình kính tràn viền  Độ sáng 250 nits  Độ phủ màu 45% NTSC,1920 x 1080 pixels (FullHD),,,32.2 x 21 x 1.99 cm (W x D x H),1.51 kg,"Wi-Fi 6, Màn hình cảm ứng, Bảo mật vân tay",,Bảo mật vân tay,HP Wide Vision 720p HD,Windows 11 Home SL,"3 Cell, 43 WHrs Li-ion polymer",Intel Wi-Fi 6E AX211 (2x2),Bluetooth 5.2 Combo,"1x  USB Type-C (Sạc, DisplayPort 1.4, HP ngủ và sạc)  2x USB Type-A  1x HDMI 2.1  1x Đầu đọc thẻ nhớ SD đa định dạng  1x Headphone/microphone combo"
Sinh viên,laptop-lenovo-ideapad-slim-3-14iah8-83eq0004vn,Laptop Lenovo IdeaPad Slim 3 14IAH8 83EQ0004VN,14000000,27,17,lenovo,ideapad,3.6,"Chip i5 12450H phù hợp với các tác vụ văn phòng cơ bản cho đến chỉnh sửa hình ảnh trên PTS Ram 8GB và ổ cứng SSD 512 mang đến tốc độ xử lí nhanh và khả năng lưu trữ lớn. Màn hình 14 inches với độ phân giải Full HD cho hình ảnh sống động, chân thực Trọng lượng chỉ gần 1.4 kg cho dễ dàng mang theo khi di chuyển",Xám,2023,Hàn Quốc,Integrated Intel UHD Graphics,"Intel Core i5-12450H (8C/ 12T, 2.00GHz up to 4.40GHz, 12MB)",8GB,LPDDR5-4800 Onboard,8GB LPDDR5-4800 Onboard,512GB M.2 2242 PCIe,512GB,60Hz,Tấm nền IPS,14 inches,Độ sáng tối đa 300 nits Chống chói,1920 x 1080 pixels (FullHD),Dolby Audio,Vỏ nhựa,324.3 x 213.8 x 17.9 mm,1.37 kg,Wi-Fi 6,,,FHD 1080p với màn trập bảo mật,Windows 11 Home,47 Wh,Wi-Fi 6 11ax 2x2,5.2,2 x USB 3.2 thế hệ 1 1 x USB-C 3.2 Gen 1 1x HDMI 1x Giắc cắm tai nghe 1 x Đầu đọc thẻ 1 x Đầu nối nguồn
Sinh viên,laptop-hp-elitebook-8470p,Laptop HP Elitebook 8470P,12000000,14,65,hp,elitebook,3.0,"Intel Graphics HD 4000 cùng chip i5 giúp bạn xử lý ổn thỏa các tác vụ văn phòng Màn hình 14 inch HD cho bạn xem phim, lướt web tốt RAM 4GB giúp việc mở ra nhiều tác vụ nhưng máy vẫn hoạt động ổn định Sở hữu nhiều cổng kết nối cơ bản giúp truyền xuất dữ liệu nhanh chóng",Bạc,2024,Trung Quốc,Intel Graphics HD 4000,"Intel Core i5-3320M (2.6 GHz,  Turbo Boost 3.5 GHz, 3 MB)",16GB,DDR3,16GB DDR3,128 GB SSD,128GB,,,14 inches,Màn hình chống chói,,,,322 x 210 x 19.9 mm (Dài x Rộng x Dày),2.4kg,Bảo mật vân tay,,,,Windows 7,,,,2 x USB 2.0 2 x USB 3.0 1 x VGA 1 x DisplayPort 1 x Đầu đọc thẻ 1 x E-sata
Sinh viên,laptop-hp-pavilion-15-eg2086tu-7c0q8pa,Laptop HP Pavilion 15-EG2086TU 7C0Q8PA,14000000,15,45,hp,pavilion,4.7,"Thiết kế tối giản với khung viền tinh tế cùng gam vàng thời thượng thu hút mọi ánh nhìn Viền máy mỏng giúp mở rộng tầm nhìn tối đa, khiến không gian xem đầy chân thật và sắc nét Màn hình 15.6 inch tấm nền IPS mang lại góc nhìn rộng cùng hình ảnh sắc nét Bộ xử lý I3-1215U đáp ứng tốt các tác vụ văn phòng và học tập Tốc độ truyền tải nhanh hơn, tiết kiệm điện và kéo dài thời gian sử dụng pin lâu hơn với RAM 8GB DDR4 3200MHz Trong lượng 1.75 kg đủ nhẹ thuận tiện mang theo và di chuyển",Vàng,2021,Singapore,Intel UHD Graphics,Intel Core i3-1215U Processor,8GB,DDR4 3200MHz,8GB DDR4 3200MHz 2 khe,256GB SSD PCIe® NVMe™ M.2,256GB,,Tấm nền IPS,15.6 inches,"IPS, 250nits, 45%NTSC, Micro-edge, BrightView",1920 x 1080 pixels (FullHD),,,36.02 x 23.4 x 1.79 cm,1.75 kg,,,,HP Wide Vision 720p HD Camera,Windows 11 Home SL,3 Cell 41WHrs,Realtek RTL8822CE 802.11a/b/g/n/ac (2x2) Wi-Fi,v5.0,1 x HDMI 2.01 x headphone/microphone combo1x Type-C tốc độ truyền dữ liệu 10gbps2 x Type-A tốc độ truyền dữ liệu 5Gbps
Sinh viên,laptop-huawei-matebook-14,Laptop Huawei Matebook 14,12000000,90,1,huawei,matebook,3.2," Thiết kế sang trọng bằng kim loại với các khung viền được hoàn thiện vuông vức  Màn hình sắc nét với độ phân giải 2K, tấm nền IPS cho trải nghiệm ấn tượng  Hoạt động mượt mà với chip Intel i5, card đồ họa Iris, cân mọi tác vụ   Pin dung lượng lớn 56Wh, kết nối dễ dàng qua Huawei Share",Bạc,2024,Nhật Bản,Intel Iris Xe,Intel Core i5-1135G7 thế hệ 11,8GB,,8GB,Ổ cứng SSD NVMe PCIe 512 GB,512GB,,Tấm nền IPS,14 inches,"IPS, sRGB 100%",2160 x 1440 pixels,Loa x 2,Vỏ kim loại,"307,5 x 223,8 x 15,9 mm","1,49 kg",Wi-Fi 6,,,HD 720p,Windows 10 Home SL,56 Wh,IEEE 802.11a/b/g/n/ac/ax,v5.1,"USB-C x 1 (hỗ trợ dữ liệu, sạc và DisplayPort)   USB 3.2 Gen1 × 2   HDMI × 1   Tai nghe 3,5 mm và jack micrô x 1"
Sinh viên,surface-laptop-go,Surface Laptop Go Core i5 / 8GB / 128 GB / 12.4 inch Nhập Khẩu Chính Hãng,15790000,22,53,microsoft,surface,4.6," Thiết kế gọn gàng với trọng lượng chỉ hơn 1.1kg, được hoàn thiện từ vật liệu cao cấp   Trải nghiệm màn hình sắc nét và cực nhạy - Màn hình 12.4"""" nhỏ gọn, 1536x1024 pixels, hỗ trợ cảm ứng  Hiệu năng mượt mà với chip Intel Core i5 thế hệ 10, RAM 8GB ổ cứng SSD 128GB  Thưởng thức âm thanh đỉnh cao - Công nghệ âm thanh Dolby Audio cao cấp và hiện đại",Trắng,2023,Đài Loan,Intel UHD Graphics,10th Gen Intel Core i5 processor – 1035G1,8GB,LPDDR4x,8GB LPDDR4x,SSD: 128GB,128GB,,Tấm nền IPS,12.4 inches,"Công nghệ màn hình PixelSense, cảm ứng đa điểm",1536 x 1024 pixels,"Mics Studio trường xa kép, Loa Omnisonic với Dolby® Audio ™",,278.18 mm x 205.67 mm x 15.69 mm,"1,110 g","Viền màn hình siêu mỏng, Wi-Fi 6, Màn hình cảm ứng, Bảo mật vân tay",,,"Camera 720p, khẩu độ f2.0",Windows 10 Home in S mode,Lên đến 13 giờ (Tùy vào nhu cầu sử dụng),Wi-Fi 6: 802.11ax,Bluetooth Wireless 5.0,1 cổng USB-C  1 cổng USB-A  1 cổng 3.5 mm headphone jack  1 cổng Surface Connect port
Sinh viên,laptop-hp-15-250-g8-85c69ea,Laptop HP 15 250 G8 85C69EA,10990000,5,27,hp,hp,2.7,"Sở hữu thiết kế thanh lịch, lớp vỏ tone màu xám sang trọng Màn hình 15.6 inch Full HD cho hình ảnh sắc nét, màu sắc sống động CPU Intel Core i5 1135G7 cho tốc độ xử lý mọi dữ liệu nhanh chóng, tiết kiệm pin hiệu quả 8GB RAM hỗ trợ mở cùng lúc trên chục tabs mà không lo giật, lag Ổ cứng 256GB đủ dùng, giúp lưu trữ file, tài liệu, hình ảnh dễ dàng",Xám,2021,Singapore,Intel Iris Xe Graphics,"Intel Core i5-1135G7 (2.4 GHz, up to 4.2 GHz, 4 lõi,  8 MB cache)",8GB,DDR4,8GB DDR4,256GB PCIE,256GB,60 Hz,Tấm nền IPS,15.6 inches,Màn hình chống chói  Độ sáng 250nits Độ phủ màu 45% NTSC,1920 x 1080 pixels (FullHD),,,35.79 x 24.21 x 1.98 cm (W x D x H),1.74 kg,Wi-Fi 6,,Mô-đun nền tảng đáng tin cậy (TPM),HP TrueVision HD Camera,Free OS,"3-cell, 41 Wh Li-ion",Wi-Fi 6,Bluetooth 5,2x USB 3.2 Gen 1 Type-A  1x USB 3.2 Gen 1 Type-C (chỉ truyền dữ liệu) 1x HDMI v1.4b 1x RJ-45 1x AC Power 1x Headphone/microphone combo jack
Sinh viên,laptop-dell-latitude-e6420,Laptop Dell Latitude E6420,25000000,2,11,dell,latitude,3.1,"Laptop hoc tập văn phòng với CPU Intel Core i5 2520M cân mọi tác vụ văn phòng Card đồ họa ‎Intel HD Graphics 3000 cho phép xử lý hình ảnh cơ bản RAM 4GB mượt mà, hỗ trợ duyệt web nhanh chóng Ổ cứng 512 GB HDD cho không gian lưu trữ rộng rãi Màn hình 14 inch cùng độ phân giải HD cho không gian làm việc, giải trí thoải mái",Đen,2022,Nhật Bản,‎Intel HD Graphics 3000,"Intel Core i5 2520M, 2.5GHz",4GB,DDR3 SDRAM ‎2.5 GHz,4GB DDR3 SDRAM ‎2.5 GHz,512 GB HDD,512GB,,,14 inches,,,,,35.31 x 24.13 x 3.30 cm,2.09 kg,,,,,Windows 10,,802.11bgn,,3x USB 2.0
Sinh viên,laptop-dell-latitude-e7450,Laptop Dell Latitude E7450,25000000,55,13,dell,latitude,1.2,"Sở hữu kích thước nhỏ gọn với trọng lượng máy chỉ 1.55kg CPU Intel Core i3-5010U cân mọi tác vụ học tập, văn phòng RAM 4GB hỗ trợ làm việc, lướt web mà không lo lag, giật Ổ cứng 120 GB SSD cho không gian lưu trữ đủ dùng Màn hình 14 inch độ phân giải HD sắc nét",Đen,2023,Đài Loan,Intel HD Graphics 5500,"Intel Core i3-5010U, 3 MB",4GB,DDR3L SDRAM (1600 MHz),4GB DDR3L SDRAM (1600 MHz) 2 khe cắm SODIMM (Nâng cấp tối đa 16 GB),SSD 120GB,SSDGB,,,14 inches,Tần số quét 60Hz,1366 x 768 pixels,"Âm thanh độ nét cao, 2x 2 W",,18.8 x 337 x 231.5 mm (Cao x Rộng x Sâu),1.55 kg,,,,HD camera,,3 cell,,Bluetooth 4.0,"1x Jack headphone  1x HDMI, mDP 1x RJ-45 3x USB 3.0 1x Docking  1x uSIM"
Sinh viên,laptop-hp-pavilion-15-eg2081tu-7c0q4pa,Laptop HP Pavilion 15-EG2081TU 7C0Q4PA,19000000,12,16,hp,pavilion,0.0,"Hiệu năng ổn định, mượt mà với các tác vụ văn phòng, học tập hay chơi game nhẹ sẽ không làm khó được chip Intel Core i5-1240P  Không dừng lại ở việc dung lượng lớn mà còn giúp tốc độ truyền tải nhanh hơn, tiết kiệm điện và kéo dài thời gian sử dụng pin lâu hơn với RAM 16GB DDR4 3200MHz  Tối ưu lưu trữ và xuất dữ liệu nhanh hơn chỉ trong một nốt nhạc với ở cứng SSD 512GB Kết nối không giới hạn, trò chuyện qua video call trên camera HP Wide Vision 720p HD",Bạc,2024,Nhật Bản,Intel Iris Xe Graphics,"Intel Core i5-1240P (up to 4.40GHz, 12MB)",16GB,DDR4 3200MHz,16GB DDR4 3200MHz  2 khe,512GB PCIe NVMe M.2 SSD,512GB,,Tấm nền IPS,15.6 inches,"IPS, micro-edge, BrightView, 250 nits, 45% NTSC",1920 x 1080 pixels (FullHD),2 loa,,36.02 x 23.4 x 1.79 cm,1.74 kg,"Viền màn hình siêu mỏng, Wi-Fi 6",,,HP Wide Vision 720p HD camera,Windows 11 Home,"3-cell, 41 Wh Li-ion",Wi-Fi 6 MediaTek MT7921 (2x2),v5.2,1 x HDMI 2.11 x headphone/microphone combo1 x Type-C tốc độ truyền dữ liệu 10Gbps2 x Type-A tốc độ truyền dữ liệu 5Gbps
Sinh viên,laptop-msi-modern-14-c13m-611vn,Laptop MSI Modern 14 C13M-611VN,12000000,77,70,msi,modern,4.0,"Sở hữu thiết kế cực mỏng nhẹ với trọng lượng chỉ 1.4kg Màn hình 14 inch Full HD cùng tấm nền IPS cho chất lượng hình ảnh sắc nét CPU Intel Core i5-1335U cân mọi tác vụ học tập, văn phòng RAM lên đến 16GB giúp mở nhiều tabs Chrome cực nhanh mà không lo lag, giật Không gian lưu trữ thoải mái với 512GB SSD",Bạc,2024,Trung Quốc,Intel Iris Xe Graphics,"Intel Core i5-1335U (Up to 4.6GHz, 10 lõi / 12 luồng)",16GB,DDR4 3200MHz Onboard,16GB DDR4 3200MHz Onboard,512GB SSD M.2 PCIe NVMe Gen3 x4,512GB,,Tấm nền IPS,14 inches,,1920 x 1080 pixels (FullHD),,,319.9 x 223 x 19.35 mm,1.4 kg,Wi-Fi 6,Đèn nền trắng,,HD Camera (30FPS 720P),Windows 11 Home,39Wh,Wi-Fi 6 802.11 ax,Bluetooth 5.2,1x USB 3.2 Gen2 Type-A  2x USB 2.0 1x USB Type-C (tích hợp Display Port) 1x HDMI (4K 60Hz) 1x Đầu đọc thẻ MicroSD 1x Mic-in/ Headphone-out combo jack
Sinh viên,laptop-acer-swift-3-sf314-512-56qn-nx-k0fsv-002,Laptop Acer Swift 3 SF314-512-56QN NX.K0FSV.002,12000000,35,80,acer,swift,0.0,"Thiết kế với trọng lượng nhẹ 1.25 kg dễ dàng mang theo mọi nơi CPU Intel Core i5-1240P mạnh mẽ cân mọi tác vụ làm việc, học tập RAM 16GB đa nhiệm hỗ trợ mở hàng chục tabs web cùng lúc không lo lag, giật Ổ cứng 512GB SSD rộng rãi giúp lưu trữ file, tài liệu thoải mái Trang bị các kết nối như: USB 3.2 Type-A, HDMI và ThunderBolt 4 giúp sao lưu, truyền tải dữ liệu tốc độ cao",Bạc,2023,Trung Quốc,Intel Iris Xe Graphics,"Intel Core i5-1240P (3.3GHz~ 4.4GHz, 12 lõi / 16 luồng)",16GB,LPDDR4X Onboard,16GB LPDDR4X Onboard,512GB SSD M.2 PCIe,512GB,60 Hz,Tấm nền IPS,14 inches,LED BacklitAcer ComfyView,2560 x 1440 pixels (2K),2W x 2Acer TrueHarmonyDTS Audio,,321 x 210.8 x 15.9 mm,1.25 kg,"Wi-Fi 6, Bảo mật vân tay",Đơn sắc - Màu trắng,,Full HD Webcam,Windows 11 Home,"3-cell Li-ion, 56Wh",Intel Wireless Wi-Fi 6E (802.11ax),Bluetooth v5.2,2x USB 3.2 Gen1 Type-A 2x Thunder Bolt 4 1x HDMI 2.0 1x Mic-in/ Headphone-out combo jack 1x DC-inLAN Gigabit
Sinh viên,laptop-asus-expertbook-b1-b1502cva-nj0149w,Laptop ASUS ExpertBook B1 B1502CVA-NJ0149W,12000000,17,73,asus,expertbook,0.0,"Máy tính này được trang bị bộ vi xử lý Intel Core i3-1315U đảm bảo hiệu suất xuất sắc trong việc thực hiện nhiều loại tác vụ. Với sự hỗ trợ của 8GB RAM và ổ đĩa SSD có dung lượng 512GB, máy này cung cấp tốc độ và hiệu suất làm việc mượt mà. Màn hình 15.6 inch, độ phân giải Full HD, đem lại trải nghiệm xem phim, lướt web và chỉnh sửa ảnh cơ bản với hình ảnh rõ nét và chất lượng cao. Cấu trúc vỏ máy được thiết kế chắc chắn, mang lại vẻ đẹp sang trọng cùng độ bền cao.",Đen,2023,Đài Loan,Intel UHD Graphics,"Intel Core i3-1315U (1.2 GHz, 10M Cache, up to 4.5 GHz, 6 lõi)",8GB,DDR4 Onboard,8GB DDR4 Onboard,512GB M.2 2280 NVMe PCIe 4.0 SSD,512GB,60 Hz,Tấm nền TN,15.6 inches,Độ sáng 250 nits  Độ phủ màu NTSC: 45% Màn hình chống chóiTỷ lệ tương phản 500:1Góc nhìn: 90/65 Thời gian phản hồi:  20/10 ms 16:9,1920 x 1080 pixels (FullHD),Âm thanh Dirac Loa tích hợp Micrô mảng tích hợp,Vỏ nhựa,36.16 x 23.30 x 1.99 cm (W x H x D),1.69 kg,"Wi-Fi 6, Bảo mật vân tay",,Cảm biến vân tay tích hợp Touchpad Khe bảo mật Kensington Nano Khởi động BIOS Bảo vệ mật khẩu người dùng Mật khẩu người dùng thiết lập BIOS Máy tính đã sẵn sàng từ BIOS Bảo vệ và bảo mật mật khẩu người dùng HDD Mô-đun nền tảng đáng,720p HD với màn trập camera,Windows 11 Home,"42WHrs, 3S1P, 3-cell Li-ion",Wi-Fi 6 (802.11ax) (Dual band) 2*2,Bluetooth 5.2,1x USB 2.0 Loại A 1x USB 3.2 Gen 1 Loại A 1x USB 3.2 Gen 1 Type-C 1x USB 3.2 Gen 2 Type-C h 1x HDMI 1.4 1x Giắc âm thanh 1x RJ45 Gigabit Ethernet
Sinh viên,laptop-asus-zenbook-14-oled-um3402ya-km405w,Laptop ASUS Zenbook 14 OLED UM3402YA-KM405W,20000000,19,30,asus,zenbook,1.2,"CPU AMD Ryzen 5 7530U xử lý nhanh chóng mọi tác vụ học tập, văn phòng. Màn hình 14 inch OLED 2.8K cho màu sắc hiển thị rực rỡ, chân thực cùng công nghệ lọc ánh sáng xanh lên đến 70%. Đồ họa AMD Radeon Graphics dễ dàng chỉnh sửa hình ảnh cơ bản hay chơi các tựa game nhẹ. Bộ nhớ RAM 16GB LPDDR4X chạy nhiều ứng dụng cùng lúc mà không lo lag giật. Ổ cứng SSD 512GB cho tốc độc truy cập dữ liệu nhanh chóng. Lớp vỏ được làm từ kim loại cao cấp, khối lượng gọn nhẹ chỉ 1.39 kg.",Đen,2021,Đài Loan,AMD Radeon Graphics,"AMD Ryzen 5 7530U (2.0GHz, 6 lõi / 12 luồng, 16MB cache, up to 4.5 GHz max boost)",16GB,LPDDR4X Onboard,16GB LPDDR4X Onboard,512GB M.2 NVMe PCIe 3.0 SSD,512GB,90 Hz,Tấm nền Oled,14 inches,Thời gian phản hồi 0.2ms  Độ sáng tối đa  400 nit HDR Độ phủ màu 100% DCI-P3 Display HDR True Black 600 1 tỉ màu PANTONE Validated Glossy display Giảm ánh sáng xanh 70% SGS Eye Care Display,2880 x 1800 pixels,Công nghệ khuếch đại thông minhLoa tích hợpMicrô mảng tích hợpHarman/kardon (Premium),Vỏ kim loại,31.36 x 22.06 x 1.69 ~ 1.69 cm (W x H x D),1.35 kg,"Wi-Fi 6, Bảo mật vân tay, Màn hình Oled",Bàn phím có đèn nền,Cảm biến vân tay tích hợp với Power Key McAfee LiveSafe Mô-đun nền tảng đáng tin cậy (TPM),1080p FHD camera,Windows 11 Home,"75WHrs, 2S2P, 4-cell Li-ion",Wi-Fi 6E(802.11ax) (Dual band) 2*2,Bluetooth® 5,1x USB 3.2 Gen 2 Type-A2x USB 3.2 Gen 2 Type-C (Hỗ trợ hiển thị / sạc)1x HDMI 2.1 TMDS1x 3.5mm Combo Audio JackĐầu đọc thẻ Micro SD
Sinh viên,laptop-asus-e210ka-gj073w,Laptop ASUS E210KA-GJ073W,18000000,47,17,asus,e210ka-gj073w,2.1,"Sở hữu thiết kế cực nhỏ gọn và mỏng nhẹ với trọng lượng chỉ 1.05 kg Bộ vi xử lý Intel Celeron N4500 hỗ trợ làm việc nhanh chóng trên các ứng dụng văn phòng 4GB RAM cùng 128GB bộ nhớ trong eMMC cực nhanh hỗ trợ lưu trữ đủ dùng Màn hình 11.6 inch cùng độ phân giải HD đáp ứng nhu cầu làm việc, giải trí Máy trang bị đầy đủ cổng kết nối, hỗ trợ truyền tải dữ liệu nhanh chóng",Xanh,2024,Singapore,Intel UHD Graphics,"Intel Celeron N4500 1.1 GHz (4M Cache, up to 2.8 GHz, 2 lõi)",4GB,DDR4 Onboard,4GB DDR4 Onboard,128 GB eMMC,128GB,60Hz,,11.6 inches,"Độ sáng 200nits Độ phủ màu 45% NTSC  Màn hình chống chói, 16:9",1366 x 768 pixels,SonicMaster Loa tích hợp Micro tích hợp sẵn,Vỏ nhựa,27.90 x 19.10 x 1.69 ~ 1.69 cm (W x H x D),1.05 kg,,,BIOS Booting bảo vệ mật khẩu người dùng Mô-đun nền tảng đáng tin cậy (Firmware TPM) BIOS setup user password,VGA camera,Windows 11 Home,"38WHrs, 2S1P, 2-cell Li-ion",Wi-Fi 5 (802.11ac) (Dual band) 2*2,Bluetooth 4.2,1x USB 2.0 Type-A 1x USB 3.2 Gen 1 Type-A 1x USB 3.2 Gen 1 Type-C 1x HDMI 1.4 1x 3.5mm Combo Audio Jack 1x DC-in
Sinh viên,laptop-dell-latitude-e7470,Laptop Dell Latitude E7470,14000000,56,60,dell,latitude,1.5,"Thiết kế thanh lịch với các góc bo nhẹ, mềm mại Màn hình 14 inch cùng độ phân giải Full HD cho hình ảnh chân thực, sắc nét CPU Intel Core i5-6300U cân mọi tác vụ văn phòng cho đến học tập RAM 8GB đa nhiệm hỗ trợ mở nhiều tab duyệt web cùng lúc Ổ cứng 256GB cho không gian lưu trữ đủ dùng khi sao lưu các file làm việc, dữ liệu học tập Hỗ trợ đa dạng cổng kết nối: HDMI, USB 3.0, Mini DisplayPort,...",Đen,2021,Đài Loan,Intel HD Graphics 520,"Intel Core i5-6300U (2.4GHz, up to 3 GHz, 3M Cache)",8GB,DDR4 2133MHz,8GB DDR4 2133MHz,256GB M.2 PCIe NVMe ổ đĩa thể rắn (M.2 SSD),256GB,,,14 inches,,1920 x 1080 pixels (FullHD),,,19.4 x 334.9 x 232 mm (Cao x Rộng x Sâu),1.42kg,,Có,,HD Webcam,Windows 10 Pro,4 cell 52Whr,,,1x HDMI  1x Đầu đọc thẻ SD 4 trong 1 3x USB 3.0 1x Mini DisplayPort
